{
  "input_method": "photo",
  "source_ref": "photo://abc123",
  "raw_input": "ramen and gyoza",
  "total_kcal": 850,
  "protein_g": 35,
  "fat_g": 28,
  "carbs_g": 95,
  "items": [
    { "name": "ramen", "grams": 500, "kcal": 600, "protein_g": 25, "fat_g": 18, "carbs_g": 70 },
    { "name": "gyoza", "grams": 150, "kcal": 250, "protein_g": 10, "fat_g": 10, "carbs_g": 25 }
  ]
}
